{
  "$schema": "http://json-schema.org/draft-07/schema#",
  "$id": "https://lumora.app/schemas/plugin-manifest.json",
  "title": "Lumora Plugin Manifest",
  "description": "Schema for lumora.plugin.json — the manifest file for a Lumora plugin.",
  "type": "object",
  "required": ["id", "name", "version", "apiVersion", "permissions", "contributions"],
  "additionalProperties": false,
  "properties": {
    "$schema": {
      "type": "string",
      "description": "JSON Schema reference (optional, for editor autocomplete)."
    },
    "id": {
      "type": "string",
      "pattern": "^[a-z0-9]+(?:\\.[a-z0-9][a-z0-9-]*)+$",
      "description": "Unique reverse-DNS plugin identifier. Must match the plugin folder name. Stable for the life of the install.",
      "examples": ["com.lumora.example.rename-by-date"]
    },
    "name": {
      "type": "string",
      "minLength": 1,
      "maxLength": 64,
      "description": "Human-readable name shown in Settings → Extensions."
    },
    "version": {
      "type": "string",
      "pattern": "^\\d+\\.\\d+\\.\\d+",
      "description": "Semver version string for the plugin."
    },
    "apiVersion": {
      "type": "integer",
      "const": 1,
      "description": "Host API contract version. Currently must be 1."
    },
    "description": {
      "type": "string",
      "maxLength": 256,
      "description": "Short description shown in the Extensions list (optional)."
    },
    "author": {
      "type": "string",
      "maxLength": 128,
      "description": "Author name or organisation (optional)."
    },
    "permissions": {
      "type": "array",
      "uniqueItems": true,
      "description": "Permission tokens the plugin requires. May be empty for no-op/read-only plugins.",
      "items": {
        "type": "string",
        "enum": [
          "read:assets",
          "read:metadata",
          "write:metadata",
          "rename:filesystem",
          "move:filesystem",
          "copy:filesystem",
          "delete:filesystem",
          "export:assets"
        ]
      }
    },
    "contributions": {
      "type": "object",
      "description": "Extension points contributed by this plugin.",
      "additionalProperties": false,
      "properties": {
        "actions": {
          "type": "array",
          "description": "Selection-scoped commands that appear in the Plugins submenu.",
          "items": {
            "$ref": "#/definitions/ActionContribution"
          }
        },
        "events": {
          "description": "Reserved for future use. Ignored in v1.",
          "type": "array"
        },
        "panels": {
          "description": "Reserved for future use. Ignored in v1.",
          "type": "array"
        },
        "providers": {
          "description": "Reserved for future use. Ignored in v1.",
          "type": "array"
        },
        "views": {
          "description": "Reserved for future use. Ignored in v1.",
          "type": "array"
        }
      }
    },
    "main": {
      "type": "string",
      "description": "Relative path to the JavaScript entry module. Required when contributions.actions is non-empty.",
      "examples": ["main.js"]
    }
  },
  "definitions": {
    "ActionContribution": {
      "type": "object",
      "required": ["id", "label", "scope"],
      "additionalProperties": false,
      "properties": {
        "id": {
          "type": "string",
          "minLength": 1,
          "description": "Unique action identifier within this plugin."
        },
        "label": {
          "type": "string",
          "minLength": 1,
          "maxLength": 64,
          "description": "Menu label shown to the user."
        },
        "scope": {
          "type": "string",
          "const": "selection",
          "description": "Scope of the action. Only 'selection' is supported in v1."
        },
        "minSelection": {
          "type": "integer",
          "minimum": 1,
          "default": 1,
          "description": "Minimum number of selected assets required to enable the action."
        },
        "maxSelection": {
          "type": "integer",
          "minimum": 1,
          "maximum": 500,
          "default": 500,
          "description": "Maximum number of selected assets the action accepts. Hard limit is 500."
        }
      }
    }
  }
}
